<?xml version="1.0" encoding="UTF-8"?>
<?xml-stylesheet type="text/xsl" href="library.xsl"?>
<!DOCTYPE root 
[
  <!ELEMENT root (element+)>
  <!ELEMENT element (address, catalog, id, name, specialty)>
  <!ELEMENT address (city, country, region, street)>
  <!ELEMENT city (#PCDATA)>
  <!ELEMENT country (#PCDATA)>
  <!ELEMENT region (#PCDATA)>
  <!ELEMENT street (#PCDATA)>
  <!ELEMENT catalog (book+)>
  <!ELEMENT book (author, availability, description, genre, isbn, title, year)>
  <!ELEMENT author (#PCDATA)>
  <!ELEMENT availability (#PCDATA)>
  <!ELEMENT description (#PCDATA)>
  <!ELEMENT genre (#PCDATA)>
  <!ELEMENT isbn (#PCDATA)>
  <!ELEMENT title (#PCDATA)>
  <!ELEMENT year (#PCDATA)>
  <!ELEMENT id (#PCDATA)>
  <!ELEMENT name (#PCDATA)>
  <!ELEMENT specialty (#PCDATA)>
]>
<root>
   <element>
      <address>
         <city>Grand Rapids</city>
         <country>United States</country>
         <region>Michigan</region>
         <street>5623 Clove Avenue</street>
      </address>
      <catalog>
         <book>
            <author>Aldis Huckster</author>
            <availability>true</availability>
            <description>Duis aliquam convallis nunc. Proin at turpis a pede posuere nonummy. Integer non velit. Donec diam neque, vestibulum eget, vulputate ut, ultrices vel, augue. Vestibulum ante ipsum primis in faucibus orci luctus et ultrices posuere cubilia Curae; Donec pharetra, magna vestibulum aliquet ultrices, erat tortor sollicitudin mi, sit amet lobortis sapien sapien non mi. Integer ac neque.</description>
            <genre>Comedy|Musical</genre>
            <isbn>168700913-9</isbn>
            <title>First Love</title>
            <year>2009</year>
         </book>
         <book>
            <author>Alleyn Saladine</author>
            <availability>true</availability>
            <description>Phasellus sit amet erat. Nulla tempus. Vivamus in felis eu sapien cursus vestibulum. Proin eu mi. Nulla ac enim. In tempor, turpis nec euismod scelerisque, quam turpis adipiscing lorem, vitae mattis nibh ligula nec sem.</description>
            <genre>Comedy|Romance</genre>
            <isbn>678248716-0</isbn>
            <title>Mr. Deeds</title>
            <year>2012</year>
         </book>
         <book>
            <author>Ced Trowl</author>
            <availability>false</availability>
            <description>Donec diam neque, vestibulum eget, vulputate ut, ultrices vel, augue. Vestibulum ante ipsum primis in faucibus orci luctus et ultrices posuere cubilia Curae; Donec pharetra, magna vestibulum aliquet ultrices, erat tortor sollicitudin mi, sit amet lobortis sapien sapien non mi. Integer ac neque. Duis bibendum. Morbi non quam nec dui luctus rutrum. Nulla tellus. In sagittis dui vel nisl. Duis ac nibh. Fusce lacus purus, aliquet at, feugiat non, pretium quis, lectus.</description>
            <genre>Documentary</genre>
            <isbn>883469015-X</isbn>
            <title>Double Dare</title>
            <year>1961</year>
         </book>
         <book>
            <author>Natal Shalliker</author>
            <availability>false</availability>
            <description>Lorem ipsum dolor sit amet, consectetuer adipiscing elit. Proin risus. Praesent lectus. Vestibulum quam sapien, varius ut, blandit non, interdum in, ante. Vestibulum ante ipsum primis in faucibus orci luctus et ultrices posuere cubilia Curae; Duis faucibus accumsan odio. Curabitur convallis.</description>
            <genre>Drama|Romance</genre>
            <isbn>481041671-2</isbn>
            <title>Some Came Running</title>
            <year>1974</year>
         </book>
         <book>
            <author>Carmita Rubinowicz</author>
            <availability>true</availability>
            <description>Proin leo odio, porttitor id, consequat in, consequat ut, nulla. Sed accumsan felis. Ut dolor quis odio consequat varius. Integer ac leo. Pellentesque ultrices mattis odio. Donec vitae nisi.</description>
            <genre>Comedy</genre>
            <isbn>558526693-4</isbn>
            <title>Jim Jefferies: BARE</title>
            <year>1960</year>
         </book>
      </catalog>
      <id>844fbd8c-d73b-45bd-9eda-9123ee18864d</id>
      <name>Schulist Inc</name>
      <specialty>Action|Drama</specialty>
   </element>
   <element>
      <address>
         <city>Oliver</city>
         <country>Canada</country>
         <region>British Columbia</region>
         <street>55 Loeprich Plaza</street>
      </address>
      <catalog>
         <book>
            <author>Nancie Coaten</author>
            <availability>false</availability>
            <description>In congue. Etiam justo. Etiam pretium iaculis justo.</description>
            <genre>Documentary</genre>
            <isbn>980168491-7</isbn>
            <title>Sound and Fury</title>
            <year>2017</year>
         </book>
         <book>
            <author>Mona McCart</author>
            <availability>false</availability>
            <description>In hac habitasse platea dictumst. Morbi vestibulum, velit id pretium iaculis, diam erat fermentum justo, nec condimentum neque sapien placerat ante. Nulla justo.
Aliquam quis turpis eget elit sodales scelerisque. Mauris sit amet eros. Suspendisse accumsan tortor quis turpis.</description>
            <genre>Documentary</genre>
            <isbn>570629696-0</isbn>
            <title>Wagner's Dream</title>
            <year>1979</year>
         </book>
         <book>
            <author>Vanni Dumbrall</author>
            <availability>true</availability>
            <description>Phasellus in felis. Donec semper sapien a libero. Nam dui.</description>
            <genre>Thriller</genre>
            <isbn>111137732-4</isbn>
            <title>Defense of the Realm</title>
            <year>1972</year>
         </book>
         <book>
            <author>Birgit Huckett</author>
            <availability>false</availability>
            <description>Duis consequat dui nec nisi volutpat eleifend. Donec ut dolor. Morbi vel lectus in quam fringilla rhoncus.

Mauris enim leo, rhoncus sed, vestibulum sit amet, cursus id, turpis. Integer aliquet, massa id lobortis convallis, tortor risus dapibus augue, vel accumsan tellus nisi eu orci. Mauris lacinia sapien quis libero.</description>
            <genre>Action|Adventure|Children|Comedy|Fantasy</genre>
            <isbn>804058621-6</isbn>
            <title>Sorcerer's Apprentice, The</title>
            <year>1975</year>
         </book>
         <book>
            <author>Gilly Pardey</author>
            <availability>true</availability>
            <description>Duis bibendum, felis sed interdum venenatis, turpis enim blandit mi, in porttitor pede justo eu massa. Donec dapibus. Duis at velit eu est congue elementum.</description>
            <genre>Sci-Fi</genre>
            <isbn>098348231-4</isbn>
            <title>Sharknado</title>
            <year>1963</year>
         </book>
      </catalog>
      <id>e2f0043e-5307-4c78-b1a5-71d56c869515</id>
      <name>Langosh, Lebsack and Nitzsche</name>
      <specialty>Action|Adventure|Crime|Drama</specialty>
   </element>
   <element>
      <address>
         <city>Saint-Lambert-de-Lauzon</city>
         <country>Canada</country>
         <region>Québec</region>
         <street>28091 Melvin Road</street>
      </address>
      <catalog>
         <book>
            <author>Bradley Paffett</author>
            <availability>false</availability>
            <description>Curabitur in libero ut massa volutpat convallis. Morbi odio odio, elementum eu, interdum eu, tincidunt in, leo. Maecenas pulvinar lobortis est.

Phasellus sit amet erat. Nulla tempus. Vivamus in felis eu sapien cursus vestibulum.

Proin eu mi. Nulla ac enim. In tempor, turpis nec euismod scelerisque, quam turpis adipiscing lorem, vitae mattis nibh ligula nec sem.</description>
            <genre>Crime|Thriller</genre>
            <isbn>255412594-5</isbn>
            <title>John Doe: Vigilante</title>
            <year>1992</year>
         </book>
         <book>
            <author>Justinian Park</author>
            <availability>false</availability>
            <description>Lorem ipsum dolor sit amet, consectetuer adipiscing elit. Proin risus. Praesent lectus.

Vestibulum quam sapien, varius ut, blandit non, interdum in, ante. Vestibulum ante ipsum primis in faucibus orci luctus et ultrices posuere cubilia Curae; Duis faucibus accumsan odio. Curabitur convallis.</description>
            <genre>Action|Comedy|Western</genre>
            <isbn>430971482-X</isbn>
            <title>Hot Lead and Cold Feet</title>
            <year>1954</year>
         </book>
         <book>
            <author>Ximenes Gee</author>
            <availability>false</availability>
            <description>Duis bibendum, felis sed interdum venenatis, turpis enim blandit mi, in porttitor pede justo eu massa. Donec dapibus. Duis at velit eu est congue elementum.</description>
            <genre>Horror|Thriller</genre>
            <isbn>468919063-1</isbn>
            <title>Carpenter, The</title>
            <year>2002</year>
         </book>
         <book>
            <author>Vasily Hancock</author>
            <availability>true</availability>
            <description>Morbi non lectus. Aliquam sit amet diam in magna bibendum imperdiet. Nullam orci pede, venenatis non, sodales sed, tincidunt eu, felis.

Fusce posuere felis sed lacus. Morbi sem mauris, laoreet ut, rhoncus aliquet, pulvinar sed, nisl. Nunc rhoncus dui vel sem.</description>
            <genre>Drama|Romance</genre>
            <isbn>299132541-0</isbn>
            <title>The Fault in Our Stars</title>
            <year>2011</year>
         </book>
         <book>
            <author>Fabien Goddert.sf</author>
            <availability>false</availability>
            <description>Fusce consequat. Nulla nisl. Nunc nisl.</description>
            <genre>Crime|Drama|Thriller</genre>
            <isbn>522331633-9</isbn>
            <title>Compulsion</title>
            <year>1954</year>
         </book>
      </catalog>
      <id>cc425b54-76f7-41a3-916f-4f853159dc56</id>
      <name>Barton LLC</name>
      <specialty>Documentary</specialty>
   </element>
   <element>
      <address>
         <city>Saint-Félicien</city>
         <country>Canada</country>
         <region>Québec</region>
         <street>569 Barnett Alley</street>
      </address>
      <catalog>
         <book>
            <author>Alex Hoble</author>
            <availability>false</availability>
            <description>Vestibulum quam sapien, varius ut, blandit non, interdum in, ante. Vestibulum ante ipsum primis in faucibus orci luctus et ultrices posuere cubilia Curae; Duis faucibus accumsan odio. Curabitur convallis.</description>
            <genre>Thriller</genre>
            <isbn>801964024-X</isbn>
            <title>Hypnotist, The (Hypnotisören)</title>
            <year>1957</year>
         </book>
         <book>
            <author>Charlena Saunter</author>
            <availability>false</availability>
            <description>In congue. Etiam justo. Etiam pretium iaculis justo.

In hac habitasse platea dictumst. Etiam faucibus cursus urna. Ut tellus.</description>
            <genre>Drama|Thriller</genre>
            <isbn>920042041-9</isbn>
            <title>Waking the Dead</title>
            <year>2005</year>
         </book>
         <book>
            <author>Ingrid Trimming</author>
            <availability>false</availability>
            <description>Phasellus in felis. Donec semper sapien a libero. Nam dui.

Proin leo odio, porttitor id, consequat in, consequat ut, nulla. Sed accumsan felis. Ut at dolor quis odio consequat varius.

Integer ac leo. Pellentesque ultrices mattis odio. Donec vitae nisi.</description>
            <genre>Drama</genre>
            <isbn>557345009-3</isbn>
            <title>Blue Angel, The (Blaue Engel, Der)</title>
            <year>2002</year>
         </book>
         <book>
            <author>Alison Stannas</author>
            <availability>false</availability>
            <description>Sed sagittis. Nam congue, risus semper porta volutpat, quam pede lobortis ligula, sit amet eleifend pede libero quis orci. Nullam molestie nibh in lectus.

Pellentesque at nulla. Suspendisse potenti. Cras in purus eu magna vulputate luctus.</description>
            <genre>Drama</genre>
            <isbn>567657398-8</isbn>
            <title>Autumn Heart, The</title>
            <year>1994</year>
         </book>
         <book>
            <author>Humfrid Rudolph</author>
            <availability>false</availability>
            <description>Duis consequat dui nec nisi volutpat eleifend. Donec ut dolor. Morbi vel lectus in quam fringilla rhoncus.

Mauris enim leo, rhoncus sed, vestibulum sit amet, cursus id, turpis. Integer aliquet, massa id lobortis convallis, tortor risus dapibus augue, vel accumsan tellus nisi eu orci. Mauris lacinia sapien quis libero.

Nullam sit amet turpis elementum ligula vehicula consequat. Morbi a ipsum. Integer a nibh.</description>
            <genre>Drama|Film-Noir</genre>
            <isbn>650645282-X</isbn>
            <title>White Rose, The (Weiße Rose, Die)</title>
            <year>1993</year>
         </book>
      </catalog>
      <id>df1024da-ef2f-472a-867c-b97699bbe56f</id>
      <name>Windler, Nader and Sipes</name>
      <specialty>Comedy</specialty>
   </element>
   <element>
      <address>
         <city>Washington</city>
         <country>United States</country>
         <region>District of Columbia</region>
         <street>78171 Westport Court</street>
      </address>
      <catalog>
         <book>
            <author>Danna Oosthout de Vree</author>
            <availability>true</availability>
            <description>Integer tincidunt ante vel ipsum. Praesent blandit lacinia erat. Vestibulum sed magna at nunc commodo placerat.

Praesent blandit. Nam nulla. Integer pede justo, lacinia eget, tincidunt eget, tempus vel, pede.

Morbi porttitor lorem id ligula. Suspendisse ornare consequat lectus. In est risus, auctor sed, tristique in, tempus sit amet, sem.</description>
            <genre>Drama</genre>
            <isbn>876579564-4</isbn>
            <title>Scott Joplin</title>
            <year>2000</year>
         </book>
         <book>
            <author>Ariela Kitchen</author>
            <availability>true</availability>
            <description>Duis bibendum. Morbi non quam nec dui luctus rutrum. Nulla tellus.

In sagittis dui vel nisl. Duis ac nibh. Fusce lacus purus, aliquet at, feugiat non, pretium quis, lectus.

Suspendisse potenti. In eleifend quam a odio. In hac habitasse platea dictumst.</description>
            <genre>Drama</genre>
            <isbn>196623719-7</isbn>
            <title>Foreign Student</title>
            <year>1990</year>
         </book>
         <book>
            <author>Vilhelmina Henrych</author>
            <availability>false</availability>
            <description>Aliquam quis turpis eget elit sodales scelerisque. Mauris sit amet eros. Suspendisse accumsan tortor quis turpis.

Sed ante. Vivamus tortor. Duis mattis egestas metus.

Aenean fermentum. Donec ut mauris eget massa tempor convallis. Nulla neque libero, convallis eget, eleifend luctus, ultricies eu, nibh.</description>
            <genre>Horror|Mystery</genre>
            <isbn>807060888-9</isbn>
            <title>Sauna</title>
            <year>1953</year>
         </book>
         <book>
            <author>Austin Paxman</author>
            <availability>true</availability>
            <description>Sed ante. Vivamus tortor. Duis mattis egestas metus.

Aenean fermentum. Donec ut mauris eget massa tempor convallis. Nulla neque libero, convallis eget, eleifend luctus, ultricies eu, nibh.</description>
            <genre>Children|Comedy</genre>
            <isbn>474641111-5</isbn>
            <title>Down and Derby</title>
            <year>1950</year>
         </book>
         <book>
            <author>Peadar Woodyatt</author>
            <availability>false</availability>
            <description>Praesent id massa id nisl venenatis lacinia. Aenean sit amet justo. Morbi ut odio.

Cras mi pede, malesuada in, imperdiet et, commodo vulputate, justo. In blandit ultrices enim. Lorem ipsum dolor sit amet, consectetuer adipiscing elit.</description>
            <genre>Action|Drama|Sci-Fi</genre>
            <isbn>953223197-8</isbn>
            <title>Snowpiercer</title>
            <year>1953</year>
         </book>
      </catalog>
      <id>96354ed7-0d00-460a-85c0-f3a92199ebb9</id>
      <name>Ernser, VonRueden and Grimes</name>
      <specialty>Drama</specialty>
   </element>
   <element>
      <address>
         <city>Decatur</city>
         <country>United States</country>
         <region>Georgia</region>
         <street>3519 Ilene Plaza</street>
      </address>
      <catalog>
         <book>
            <author>Joey Gant</author>
            <availability>false</availability>
            <description>Proin eu mi. Nulla ac enim. In tempor, turpis nec euismod scelerisque, quam turpis adipiscing lorem, vitae mattis nibh ligula nec sem.

Duis aliquam convallis nunc. Proin at turpis a pede posuere nonummy. Integer non velit.</description>
            <genre>Drama</genre>
            <isbn>055476243-9</isbn>
            <title>Priest</title>
            <year>1982</year>
         </book>
         <book>
            <author>Windham Tunnah</author>
            <availability>true</availability>
            <description>Maecenas leo odio, condimentum id, luctus nec, molestie sed, justo. Pellentesque viverra pede ac diam. Cras pellentesque volutpat dui.

Maecenas tristique, est et tempus semper, est quam pharetra magna, ac consequat metus sapien ut nunc. Vestibulum ante ipsum primis in faucibus orci luctus et ultrices posuere cubilia Curae; Mauris viverra diam vitae quam. Suspendisse potenti.</description>
            <genre>Comedy</genre>
            <isbn>361989335-7</isbn>
            <title>Why Are the Bells Ringing, Mitica? (a.k.a. Carnival Scenes) (De ce trag clopotele, Mitica?)</title>
            <year>2015</year>
         </book>
         <book>
            <author>Ximenes Cargen</author>
            <availability>true</availability>
            <description>Sed sagittis. Nam congue, risus semper porta volutpat, quam pede lobortis ligula, sit amet eleifend pede libero quis orci. Nullam molestie nibh in lectus.

Pellentesque at nulla. Suspendisse potenti. Cras in purus eu magna vulputate luctus.</description>
            <genre>Horror</genre>
            <isbn>880058449-7</isbn>
            <title>C.H.U.D.</title>
            <year>1990</year>
         </book>
         <book>
            <author>Porty Widdows</author>
            <availability>true</availability>
            <description>Praesent blandit. Nam nulla. Integer pede justo, lacinia eget, tincidunt eget, tempus vel, pede.

Morbi porttitor lorem id ligula. Suspendisse ornare consequat lectus. In est risus, auctor sed, tristique in, tempus sit amet, sem.

Fusce consequat. Nulla nisl. Nunc nisl.</description>
            <genre>Crime|Drama</genre>
            <isbn>193253604-3</isbn>
            <title>Ruby</title>
            <year>1963</year>
         </book>
         <book>
            <author>Gran Boodell</author>
            <availability>true</availability>
            <description>Duis aliquam convallis nunc. Proin at turpis a pede posuere nonummy. Integer non velit.</description>
            <genre>Drama|Fantasy|Horror|Mystery|Thriller</genre>
            <isbn>122283061-2</isbn>
            <title>Man Who Haunted Himself, The</title>
            <year>1961</year>
         </book>
      </catalog>
      <id>eeb6a720-ea0d-4f14-b653-d03cfc06cf04</id>
      <name>Beahan-Welch</name>
      <specialty>Adventure|Comedy</specialty>
   </element>
   <element>
      <address>
         <city>New Orleans</city>
         <country>United States</country>
         <region>Louisiana</region>
         <street>8 Springview Plaza</street>
      </address>
      <catalog>
         <book>
            <author>Jordanna McCluin</author>
            <availability>false</availability>
            <description>Vestibulum quam sapien, varius ut, blandit non, interdum in, ante. Vestibulum ante ipsum primis in faucibus orci luctus et ultrices posuere cubilia Curae; Duis faucibus accumsan odio. Curabitur convallis.</description>
            <genre>(no genres listed)</genre>
            <isbn>468216043-5</isbn>
            <title>Mark Shoots First</title>
            <year>1953</year>
         </book>
         <book>
            <author>Melisent Heeran</author>
            <availability>true</availability>
            <description>Vestibulum ac est lacinia nisi venenatis tristique. Fusce congue, diam id ornare imperdiet, sapien urna pretium nisl, ut volutpat sapien arcu sed augue. Aliquam erat volutpat.</description>
            <genre>Drama</genre>
            <isbn>899185912-7</isbn>
            <title>Girls Can't Swim (Filles ne savent pas nager, Les)</title>
            <year>1993</year>
         </book>
         <book>
            <author>Kevan Hartnup</author>
            <availability>true</availability>
            <description>In hac habitasse platea dictumst. Etiam faucibus cursus urna. Ut tellus.

Nulla ut erat id mauris vulputate elementum. Nullam varius. Nulla facilisi.</description>
            <genre>Drama|Thriller</genre>
            <isbn>576409862-9</isbn>
            <title>Confess</title>
            <year>1952</year>
         </book>
         <book>
            <author>Maurice Sapsed</author>
            <availability>false</availability>
            <description>Nulla ut erat id mauris vulputate elementum. Nullam varius. Nulla facilisi.

Cras non velit nec nisi vulputate nonummy. Maecenas tincidunt lacus at velit. Vivamus vel nulla eget eros elementum pellentesque.</description>
            <genre>Drama</genre>
            <isbn>848787384-7</isbn>
            <title>Lost Horizon</title>
            <year>2018</year>
         </book>
         <book>
            <author>Tad Glavias</author>
            <availability>true</availability>
            <description>Donec diam neque, vestibulum eget, vulputate ut, ultrices vel, augue. Vestibulum ante ipsum primis in faucibus orci luctus et ultrices posuere cubilia Curae; Donec pharetra, magna vestibulum aliquet ultrices, erat tortor sollicitudin mi, sit amet lobortis sapien sapien non mi. Integer ac neque.

Duis bibendum. Morbi non quam nec dui luctus rutrum. Nulla tellus.

In sagittis dui vel nisl. Duis ac nibh. Fusce lacus purus, aliquet at, feugiat non, pretium quis, lectus.</description>
            <genre>Comedy|Drama</genre>
            <isbn>809743996-4</isbn>
            <title>Crime and Punishment in Suburbia</title>
            <year>2003</year>
         </book>
      </catalog>
      <id>c05d468a-7d24-4221-a687-136f9576ee2a</id>
      <name>Konopelski Group</name>
      <specialty>Drama|Film-Noir</specialty>
   </element>
   <element>
      <address>
         <city>Garden Grove</city>
         <country>United States</country>
         <region>California</region>
         <street>31184 Reindahl Court</street>
      </address>
      <catalog>
         <book>
            <author>Tillie Giacubo</author>
            <availability>false</availability>
            <description>In hac habitasse platea dictumst. Morbi vestibulum, velit id pretium iaculis, diam erat fermentum justo, nec condimentum neque sapien placerat ante. Nulla justo.

Aliquam quis turpis eget elit sodales scelerisque. Mauris sit amet eros. Suspendisse accumsan tortor quis turpis.</description>
            <genre>Drama|Mystery|Thriller</genre>
            <isbn>455750706-9</isbn>
            <title>Julia and Julia (Giulia e Giulia)</title>
            <year>1971</year>
         </book>
         <book>
            <author>Bili Halesworth</author>
            <availability>true</availability>
            <description>Praesent id massa id nisl venenatis lacinia. Aenean sit amet justo. Morbi ut odio.

Cras mi pede, malesuada in, imperdiet et, commodo vulputate, justo. In blandit ultrices enim. Lorem ipsum dolor sit amet, consectetuer adipiscing elit.</description>
            <genre>Adventure|Romance|Western</genre>
            <isbn>303474812-4</isbn>
            <title>California Conquest</title>
            <year>2019</year>
         </book>
         <book>
            <author>Christoffer Rosenfield</author>
            <availability>true</availability>
            <description>Proin interdum mauris non ligula pellentesque ultrices. Phasellus id sapien in sapien iaculis congue. Vivamus metus arcu, adipiscing molestie, hendrerit at, vulputate vitae, nisl.</description>
            <genre>Comedy|Drama|Musical</genre>
            <isbn>491384438-5</isbn>
            <title>It's Always Fair Weather</title>
            <year>1995</year>
         </book>
         <book>
            <author>Blondelle Lowdes</author>
            <availability>true</availability>
            <description>Cum sociis natoque penatibus et magnis dis parturient montes, nascetur ridiculus mus. Vivamus vestibulum sagittis sapien. Cum sociis natoque penatibus et magnis dis parturient montes, nascetur ridiculus mus.

Etiam vel augue. Vestibulum rutrum rutrum neque. Aenean auctor gravida sem.

Praesent id massa id nisl venenatis lacinia. Aenean sit amet justo. Morbi ut odio.</description>
            <genre>Drama|Romance</genre>
            <isbn>018344189-3</isbn>
            <title>Moment to Remember, A (Nae meorisokui jiwoogae)</title>
            <year>1984</year>
         </book>
         <book>
            <author>Napoleon Jersch</author>
            <availability>true</availability>
            <description>Integer ac leo. Pellentesque ultrices mattis odio. Donec vitae nisi.

Nam ultrices, libero non mattis pulvinar, nulla pede ullamcorper augue, a suscipit nulla elit ac nulla. Sed vel enim sit amet nunc viverra dapibus. Nulla suscipit ligula in lacus.

Curabitur at ipsum ac tellus semper interdum. Mauris ullamcorper purus sit amet nulla. Quisque arcu libero, rutrum ac, lobortis vel, dapibus at, diam.</description>
            <genre>Comedy|Drama</genre>
            <isbn>913194025-0</isbn>
            <title>Outrageous Class (Hababam sinifi)</title>
            <year>1963</year>
         </book>
      </catalog>
      <id>7e993926-0c92-43d2-b216-682b98e3cb7f</id>
      <name>Smitham LLC</name>
      <specialty>Drama|Romance|War</specialty>
   </element>
   <element>
      <address>
         <city>Sherwood Park</city>
         <country>Canada</country>
         <region>Alberta</region>
         <street>1247 Scofield Junction</street>
      </address>
      <catalog>
         <book>
            <author>Cosette Casarini</author>
            <availability>true</availability>
            <description>Praesent id massa id nisl venenatis lacinia. Aenean sit amet justo. Morbi ut odio.

Cras mi pede, malesuada in, imperdiet et, commodo vulputate, justo. In blandit ultrices enim. Lorem ipsum dolor sit amet, consectetuer adipiscing elit.</description>
            <genre>Drama</genre>
            <isbn>473794964-7</isbn>
            <title>Miss Kicki</title>
            <year>1985</year>
         </book>
         <book>
            <author>Loretta Sego</author>
            <availability>true</availability>
            <description>Duis bibendum, felis sed interdum venenatis, turpis enim blandit mi, in porttitor pede justo eu massa. Donec dapibus. Duis at velit eu est congue elementum.

In hac habitasse platea dictumst. Morbi vestibulum, velit id pretium iaculis, diam erat fermentum justo, nec condimentum neque sapien placerat ante. Nulla justo.

Aliquam quis turpis eget elit sodales scelerisque. Mauris sit amet eros. Suspendisse accumsan tortor quis turpis.</description>
            <genre>Drama</genre>
            <isbn>940309777-9</isbn>
            <title>Dancing at Lughnasa</title>
            <year>2002</year>
         </book>
         <book>
            <author>Reg Parnby</author>
            <availability>false</availability>
            <description>Phasellus in felis. Donec semper sapien a libero. Nam dui.

Proin leo odio, porttitor id, consequat in, consequat ut, nulla. Sed accumsan felis. Ut at dolor quis odio consequat varius.

Integer ac leo. Pellentesque ultrices mattis odio. Donec vitae nisi.</description>
            <genre>Drama</genre>
            <isbn>664064847-4</isbn>
            <title>Hedda Gabler</title>
            <year>2011</year>
         </book>
         <book>
            <author>Chlo Drake</author>
            <availability>false</availability>
            <description>Duis aliquam convallis nunc. Proin at turpis a pede posuere nonummy. Integer non velit.</description>
            <genre>Crime|Drama|Romance|Thriller</genre>
            <isbn>778374062-6</isbn>
            <title>Shoot the Piano Player (Tirez sur le pianiste)</title>
            <year>2007</year>
         </book>
         <book>
            <author>Trstram Kenney</author>
            <availability>false</availability>
            <description>Aenean lectus. Pellentesque eget nunc. Donec quis orci eget orci vehicula condimentum.</description>